6_001	Fraksi Partai Demokrat di MPR menggelar sarasehan dengan tema GBHN.	Fraksi Partai DEmokrat di EM-PE-ER menggelar sarasEhan dengan tEma GE-BE-HA-EN.
6_002	GBHN merupakan garis besar atau Sistem Perencanaan Pembangunan Nasional.	GE-BE-HA-EN merupakan garis besar atau Sistem Perencanaan Pembangunan Nasional.
6_003	Hidayat Nur Wahid mengkhawatirkan jika MEA berlaku maka narkoba semakin mengancam	Hidayat Nur Wahid mengkhawatirkan jika MEA berlaku maka narkoba semakin mengancam
6_004	Pada awal dua ribu enam belas, Masyarakat Ekonomi atau MEA ASEAN mulai berlaku.	Pada awal dua ribu enam belas, Masyarakat Ekonomi atau MEA ASEAN mulai berlaku.
6_005	Simposium itu bertema Refleksi Nasional Praktik Konstitusi dan Ketatanegaraan Pasca Reformasi.	Simposium itu bertEma REflEksi Nasional Praktik Konstitusi dan Ketatanegaraan Pasca REformasi.
6_006	Ketua MPR Zulkifli Hasan berpendapat bahwa ada capaian positif dalam perkembangan demokratisasi	Ketua EM-PE-ER Zulkifli Hasan berpendapat bahwa ada capaian positif dalam perkembangan dEmokratisasi
6_007	Pimpinan MPR RI Tutup Secara Resmi Outbound empat Pilar MPR di Bengkulu.	Pimpinan EM-PE-ER ER-I tutup secara resmi aut-bound empat Pilar EM-PE-ER di Bengkulu.
6_008	Kepala Kesbangpol Kabupaten Magelang Arya Humanita mengatakan kegiatan sosialisasi ini untuk menumbuhkan rasa nasionalisme.	Kepala Kesbangpol KabupatEn Magelang Arya Humanita mengatakan kegiatan sosialisasi ini untuk menumbuhkan rasa nasionalisme.
6_009	Upacara bendera ditujukan untuk memupuk rasa nasionalisme di tengah menurunnya rasa kebangsaan.	Upacara bendEra ditujukan untuk memupuk rasa nasionalisme di tengah menurunnya rasa kebangsaan.
6_010	Wakil Presiden Jusuf Kalla meminta pemangku kepentingan untuk mengevaluasi pembelian helikopter kepresidenan produk Agusta Westland.	Wakil PrEsidEn Yusuf Kalla meminta pemangku kepentingan untuk meng-Evaluasi pembelian hElikopter keprEsidEnan produk Agusta WEst-lend.
6_011	Kalau negeri ini mau maju maka harus membangun pendidikan dan rumah sakit kata Ketua MPR DR. HC. Zulkifli Hasan.	Kalau negri ini mau maju maka harus membangun pendidikan dan rumah sakit kata Ketua EM-PE-ER DE-ER. HA-CE. Zulkifli Hasan.
6_012	Peresmian Paviliun B RSU Siloam di Lippo Karawaci dilakukan minggu lalu.	Peresmian Paviliun BE ER-ES-U Siloam di Lippo Karawaci dilakukan minggu lalu.
6_013	Wakil Ketua MPR Mahyudin melantik anggota pergantian antarwaktu atau PAW.	Wakil Ketua EM-PE-ER Mahyudin melantik anggota pergantian antarwaktu atau PE-A-WE.
6_014	Mereka yang dilantik menjadi anggota baru MPR adalah Hetifah dari Fraksi Partai Golkar dari Dapil Kalimantan Timur dan Junaidi Auly.	MerEka yang dilantik menjadi anggota baru EM-PE-ER adalah HEtifah dari Fraksi Partai Golkar dari Dapil Kalimantan Timur dan Junaidi Auli.
6_015	Popong berpendapat bahwa narkoba adalah bahaya laten.	Popong berpendapat bahwa narkoba adalah bahaya latEn.
6_016	Revolusi mental dan revolusi iman, dua-duanya harus kita sokong ujar Ghazali Abbas.	REvolusi mEntal dan rEvolusi iman, dua-duanya harus kita sokong ujar Ghazali Abbas.
6_017	Puluhan blogger yang dibagi dalam dua grup itu mempresentasikan bagaimana mereka mencari format yang sesuai.	Puluhan blogger yang dibagi dalam dua grup itu memprEsentasikan bagaimana MerEka mencari format yang sesuai.
6_018	Mereka berada di kota budaya itu untuk mengikuti Netizen Gathering empat Pilar MPR.	MerEka berada di kota budaya itu untuk mengikuti NEtizEn GE-the-ring empat Pilar EM-PE-ER.
6_019	Ketua Umum PKB Muhaimin Iskandar mengatakan acara ini merupakan acara yang strategis bagi bangsa dan negara.	Ketua Umum PE-KA-BE Muhaimin Iskandar mengatakan acara ini merupakan acara yang stratEgis bagi bangsa dan negara.
6_020	Duta Besar Kuba untuk Indonesia, Nirsia Castro Guevara mengajak Indonesia mendukung pelucutan senjata nuklir.	Duta Besar Kuba untuk IndonEsia, Nir-sia Kastro GuEvara mengajak IndonEsia mendukung pelucutan senjata nuklir.
6_021	Mahyudin mendukung dan mengapresiasi sikap tegas TNI AU.	Mahyudin mendukung dan mengaprEsiasi sikap tegas TE-EN-I AU.
6_022	TNI AU menurunkan paksa pesawat tanpa izin yang melintas di atas wilayah nusantara.	TE-EN-I AU menurunkan paksa pesawat tanpa izin yang melintas di atas wilayah nusantara.
6_023	Presiden RI meninjau pembangunan jalan tol KM tujuh puluh tujuh Trans Sumatera.	PrEsidEn ER-I meninjau pembangunan jalan tol KA-EM tujuh puluh tujuh Trans Sumatra.
6_024	Silaturahmi nasional atau silatnas menurutnya sangat baik untuk membangun komunikasi antar sesama kader Golkar.	Silaturahmi nasional atau silatnas menurutnya sangat baik untuk membangun komunikasi antar sesama kader Golkar.
6_025	Partai Keadilan Sejahtera atau PKS menggelar Mukernas empat di Bumi Wiyata, Depok, Jawa Barat.	Partai Keadilan Sejahtera atau PKS menggelar Mukernas empat di Bumi Wiyata, DEpok, Jawa Barat.
6_026	Aburizal Bakrie mendorong Fraksi Partai Golkar di MPR agar melakukan amandemen sesuai dengan mukadimah.	Aburizal Bakri mendorong Fraksi Partai Golkar di EM-PE-ER agar melakukan amandemEn sesuai dengan mukadimah.
6_027	Rambe Kamarulzaman mengatakan kegiatan sosialiasi ini merupakan kerja sama Fraksi Partai Golkar di MPR dengan sayap-sayap Partai Golkar.	RambE Kamarulzaman mengatakan kegiatan sosialiasi ini merupakan kerja sama Fraksi Partai Golkar di EM-PE-ER dengan sayap-sayap Partai Golkar.
6_028	Menjelang Munas pada bulan Desember, Pengurus Pusat Ikatan Dai Indonesia atau Ikadi melakukan audiensi dengan Wakil Ketua MPR Hidayat Nur Wahid.	Menjelang Munas pada bulan DEsEmber, Pengurus Pusat Ikatan Dai Indonesia atau Ikadi melakukan audiEnsi dengan Wakil Ketua EM-PE-ER Hidayat Nur Wahid.
6_029	Focus Group Discussion bertema Implementasi Pancasila dan UUD NRI Tahun sembilan belas empat lima Bidang Ketatanegaraan.	Fokus Grup Dis-kas-siyen bertEma ImplemEntasi Pancasila dan U-U-DE EN-ER-I Tahun sembilan belas empat lima Bidang Ketatanegaraan.
6_030	Acara itu bertempat di Aula Nyi Endang Darma, Universitas Wiralodra, Indramayu, Jawa Barat.	Acara itu bertempat di Aula Nyi Endang Darma, UnivErsitas Wiralodra, Indramayu, Jawa Barat.
6_031	Seharusnya dalam dunia olah raga menurut Zulkifli seluruh pihak terkait harus bertindak sportif.	Seharusnya dalam dunia olah raga menurut Zulkifli seluruh pihak terkait harus bertindak sportif.
6_032	Forum Marga Adat Ketibung meresmikan Masjid Nurul Ullum, Umbul Niti, Lampung.	Forum Marga Adat Ketibung meresmikan Masjid Nurul Ullum, Umbul Niti, Lampung.
6_033	Abdul Kadir Karding dengan mantap mengungkapkan perubahan yang paling mendasar adalah termuatnya Hak Asasi Manusia atau HAM.	Abdul Kadir Karding dengan mantap mengungkapkan perubahan yang paling mendasar adalah termuatnya Hak Asasi Manusia atau HAM.
6_034	Anggota Badan Pengkajian MPR Shodiq Mujahid mengungkapkan MPR sedang mendorong pembentukan sebuah badan semacam BP7	Anggota Badan Pengkajian EM-PE-ER Shodiq Mujahid mengungkapkan EM-PE-ER sedang mendorong pembentukan sebuah badan semacam BE-PE tujuh
6_035	Kita tidak melakukan indoktrinasi.	Kita tidak melakukan indoktrinasi.
6_036	Pancasila bukan untuk kepentingan penguasa seperti pada masa Orde Baru.	Pancasila bukan untuk kepentingan penguasa seperti pada masa Orde Baru.
6_037	Indonesia dan Tiongkok sepakat untuk tingkatkan kerjasama bilateral.	IndonEsia dan Tiongkok sepakat untuk tingkatkan kerjasama bilateral.
6_038	Isu soal pemotongan anggaran pendidikan hanyalah hoax belaka.	Isu soal pemotongan anggaran pendidikan hanyalah hoaks belaka.
6_039	Ratusan mahasiswa Universitas Sriwijaya Palembang atau Unsri mengenakan jaket kuning almamater mereka yang khas.	Ratusan mahasiswa UnivErsitas Sriwijaya PalEmbang atau Unsri mengenakan jakEt kuning almamater MerEka yang khas.
6_040	Bambang Sadono miris dengan sistem ketatanegaraan Indonesia yang banyak sekali bersinggungan satu dengan yang lainnya.	Bambang Sadono miris dengan sistem ketatanegaraan IndonEsia yang banyak sekali bersinggungan satu dengan yang lainnya.
6_041	Seminar di ternate membahas Multi Tafsir terhadap ketetapan MPR.	Seminar di ternatE membahas Multi Tafsir terhadap ketetapan EM-PE-ER.
6_042	Maruf Cahyono merasakan hal yang luar biasa ketika pelajar SMA dua Kristen Binsus Tomohon Sulawesi Utara memainkan musik kulintang.	Maruf Cahyono merasakan hal yang luar biasa ketika pelajar ES-EM-A dua Kristen Binsus Tomohon Sulawesi Utara memainkan musik kulintang.
6_043	Kehadiran Ketua MPR di kampus Universitas Muhammadiyah Malang atau UMM adalah untuk membuka acara Pengenalan Studi Mahasiswa Baru atau Pesmaba.	Kehadiran Ketua EM-PE-ER di kampus UnivErsitas Muhammadiyah Malang atau U-EM-EM adalah untuk membuka acara Pengenalan Studi Mahasiswa Baru atau Pesmaba.
6_044	Junimart Girsang meminta media untuk berkontribusi lebih besar.	Junimart Girsang meminta mEdia untuk berkontribusi lebih besar.
6_045	Zulkifli Hasan menghadiri undangan acara Taaruf Musyawarah Nasional MUI.	Zulkifli Hasan menghadiri undangan acara Taaruf Musyawarah Nasional EM-U-I.
6_046	Tema acaranya adalah Islam Wasathiyah Untuk Indonesia dan Dunia Yang Berkeadilan dan Berkeadaban.	TEma acaranya adalah Islam Wasathiyah Untuk IndonEsia dan Dunia Yang Berkeadilan dan Berkeadaban.
6_047	Majelis Ulama Indonesia menggelar acara di Ballroom Garden Palace Hotel Surabaya.	Majelis Ulama IndonEsia menggelar acara di Boll-rum Garden PE-lEs HotEl Surabaya.
6_048	Alun Alun Karanganyar yang terhampar luas di depan kantor Kabupaten Karanganyar.	Alun Alun Karanganyar yang terhampar luas di depan kantor KabupatEn Karanganyar.
6_049	Ki Warseno Slenk dalang kelahiran Klateng akan memainkan lakon Banjaran Setyaki.	Ki WarsEno SlEng dalang kelahiran Klateng akan memainkan lakon Banjaran Setyaki.
6_050	UU Komisi Yudisial perlu direvisi.	UU Komisi Yudisial perlu dirEvisi.
6_051	Misalnya untuk memenej secara tepat pembuangan air.	Misalnya untuk memEnEj secara tepat pembuangan air.
6_052	Mobil Baleno hijau metalik adalah mobil Cina yang hebat.	Mobil BalEno hijau mEtalik adalah mobil Cina yang hEbat.
6_053	Mochtar Buchori merespons hal itu.	Mochtar Buchori merEspons hal itu.
6_054	Direktur Masalah-Masalah Philipina.	DirEktur masalah-masalah Filipina.
6_055	Entah hidup sebagai rohaniwan atau awam.	Entah hidup sebagai rohaniwan atau awam.
6_056	Ia menjawab Hai bapakku.	Ia menjawab Hai bapakku.
6_057	Ia menusuk dan mengoyak-ngoyak.	Ia menusuk dan mengoyak-ngoyak.
6_058	Juga dipicu oleh faktor-faktor lain jelas Zein.	Juga dipicu oleh faktor-faktor lain jelas ZEin.
6_059	Kalau untuk bulan januari berapa?	Kalau untuk bulan januari berapa?
6_060	Kantor terpadu untuk polisi air.	Kantor terpadu untuk polisi air.
6_061	Hai orang-orang yang beriman.	Hai orang-orang yang beriman.
6_062	Ketua Fraksi Partai Golkar DPRD DIY Khairuddin mengakui secara khusus tentang kacaunya PDIP.	Ketua Fraksi Partai Golkar DE-PE-ER-DE DE-I-YE Khairuddin mengakui secara khusus tentang kacaunya PE-DE-I-PE.
6_063	Ketua Korps Pegawai RI menyoroti banyak hal khususnya polusi asap knalpot kendaraan bermotor.	Ketua Korps Pegawai ER-I menyoroti banyak hal khususnya polusi asap knalpot kendaraan bermotor.
6_064	Koperasi Pegawai Logistik yang menjual jam weker.	Koperasi Pegawai Logistik yang menjual jam wEker.
6_065	Kosong enam kosong tujuh dan Kosong empat kosong lima.	Kosong enam kosong tujuh dan Kosong empat kosong lima.
6_066	Sutradara Gintings yang sempat berbicara mengenai wewenangnya di Hotel Sahid Jaya.	Sutradara Gintings yang sempat berbicara mengenai wewenangnya di HotEl Sahid Jaya.
6_067	Di dalam draf awal disebutkan rancangan aturan dari sentralisme ke otonomi.	Di dalam draf awal disebutkan rancangan aturan dari sEntralisme ke otonomi.
6_068	Dengan istigfar dulu dipegangnya colokan itu dan tersetrum.	Dengan istigfar dulu, dipegangnya colokan itu dan tersetrum.
6_069	Di Pulau Okinawa, hanya ada sembilan puluh delapan anggota polisi.	Di Pulau Okinawa, hanya ada sembilan puluh delapan anggota polisi.
6_070	Akan terjadi kekacauan kalau air sungai Kahayan meluap.	Akan terjadi kekacauan kalau air sungai Kahayan meluap.
6_071	Di atas mobil golfnya, Dan Hughes melambaikan tangannya ke arah massa.	Di atas mobil golfnya, Dan Hu-ghes melambaikan tangannya ke arah massa.
6_072	Kalau Anda pilih Hotel Spinghar kami setuju saja.	Kalau Anda pilih HotEl Spinghar kami setuju saja.
6_073	Kalau Australia mau cuci tangan, kita bawa saja ke pengadilan internasional.	Kalau Australia mau cuci tangan, kita bawa saja ke pengadilan internasional.
6_074	Kalau granat itu meledak, bisa celaka kita.	Kalau granat itu meledak, bisa celaka kita.
6_075	Hal itu dikenal juga sebagai konsep dwifungsi.	Hal itu dikenal juga sebagai konsEp dwifungsi.
6_076	Dalam perspektif pluralisme hal itu bukan konsep negara.	Dalam perspEktif pluralisme hal itu bukan konsEp negara.
6_077	Dan itu adalah China Petroleum ujar Ikrar.	Dan itu adalah China PEtroleum ujar Ikrar.
6_078	Disitanya satu pisau lipat dari koper kabin itu.	Disitanya satu pisau lipat dari koper kabin itu.
6_079	Di aula desa sudah berkumpul Kodim dan Satpol PP Pemkab Jepara.	Di aula dEsa sudah berkumpul Kodim dan Satpol PP PEmkab Jepara.
6_080	Kepala Subseksi Geofisika mengatakan gempa terjadi dalam tujuh skala richter.	Kepala SubsEksi GEofisika mengatakan gempa terjadi dalam tujuh skala richter.
6_081	Peti jenazah Yesus.	Peti jenazah YEsus.
6_082	Kalau rame-rame begini terasa atmosfer akrabnya.	Kalau ramE-ramE begini terasa atmosfEr akrabnya.
6_083	Bambang Sudibyo untuk Menkeu.	Bambang Sudibyo untuk Men-keu.
6_084	Mohon informasi tentang akte kelahiran.	Mohon informasi tentang akte kelahiran.
6_085	Dan jelas wewenang dari pelaksananya serta sah panggilannya.	Dan jelas wewenang dari pelaksananya serta sah panggilannya.
6_086	Di antaranya, zone ekonomi.	Di antaranya, zone Ekonomi.
6_087	Inspektur Jenderal Sufyan Yakub hanya punya tujuh puluh enam anggota pleton.	InspEktur JEnderal Sufyan Yakub hanya punya tujuh puluh enam anggota ple-ton.
6_088	Kalau hendak diekspor lagi perlu standarisasi ukuran dan berat.	Kalau hendak diEkspor lagi perlu standarisasi ukuran dan berat.
6_089	Kita tidak memakai wewangian ujar Elza.	Kita tidak memakai wewangian ujar Elza.
6_090	Kalau MPR tidak mau mengesahkan efek psikologisnya lumayan juga ujarnya.	Kalau EM-PE-ER tidak mau mengesahkan EfEk psikologisnya lumayan juga ujarnya.
6_091	Mohon informasi tentang persyaratan HGB, IMB, KK, KTP, NPWP, PBB dan SHM.	Mohon informasi tentang persyaratan HA-GE-BE, I-EM-BE, KA-KA, KA-TE-PE, EN-PE-WE-PE, PE-BE-BE dan ES-HA-EM.
6_092	Cinta Jangan Kau Pergi.	Cinta Jangan Kau Pergi.
6_093	Bangau berkata saya masih pusing.	Bangau berkata saya masih pusing.
6_094	Akibat kebiasaannya merokok sejak remaja, ia menderita penyakit paru obstruktif kronik.	Akibat kebiasaannya merokok sejak remaja, ia menderita penyakit paru ob-struk-tif kronik.
6_095	Ini bukan perang etnis apalagi perang agama, hanya perang kepentingan saja.	Ini bukan perang Etnis apalagi perang agama, hanya perang kepentingan saja.
6_096	Bahwa film itu kurang detail seperti bukunya terjadi karena keterbatasan waktu.	Bahwa film itu kurang detail seperti bukunya terjadi karena keterbatasan waktu.
6_097	Begitu bel ronde awal dibunyikan, penonton bersorak riuh.	Begitu bEl ronde awal dibunyikan, penonton bersorak riuh.
6_098	Beda antara dokumen milik Kwik dan Putu terletak pada formatnya.	BEda antara dokumEn milik Kwik dan Putu terletak pada formatnya.
6_099	Ia tidak datang akibat hujan, belum lagi badai juga cukup kencang.	Ia tidak datang akibat hujan, belum lagi badai juga cukup kencang.
6_100	Ini dia lakukan dalam upaya membuktikan klaimnya.	Ini dia lakukan dalam upaya membuktikan klaimnya.
6_101	Dalam rangka tutup buku tahun dua ribu lima semua laporan harus sudah masuk hari ini.	Dalam rangka tutup buku tahun dua ribu lima semua laporan harus sudah masuk hari ini.
6_102	Mohon penjelasan tentang Pin partisipan.	Mohon penjelasan tentang Pin partisipan.
6_103	Motor ekonomi digeser ke swasta.	Motor Ekonomi digEsEr ke swasta.
6_104	Mozaik dan lainnya tidak semata-mata ditentukan oleh sosok Syahril.	Mo-za-ik dan lainnya tidak semata-mata ditentukan olEh sosok Syah-ril.
6_105	Muchsin mengatakan harga ini akan ditinjau setiap bulan.	Muh-sin mengatakan harga ini akan ditinjau setiap bulan.
6_106	Mudah-mudahan masalah ini tidak masuk ke ILO.	Mudah-mudahan masalah ini tidak masuk ke I-EL-O.
6_107	Mufti Fajar muntah dan mencret.	Muf-ti Fa-jar muntah dan mEncrEt.
6_108	Mugabe dapat saja mengklaim kemenangan dalam pemilihan presiden di Zimbabwe.	Mu-ga-bE dapat saja mengklaim kemenangan dalam pemilihan prEsidEn di Zim-bab-wE.
6_109	Muhaimin Iskandar seusai bertemu Presiden Abdurrahman Wahid di Istana Merdeka.	Mu-hai-min Iskandar seusai bertemu prEsidEn Ab-dur-rah-man Wahid di Istana MerdEka.
6_110	Muhammad Jam dan Muhammad Khirom mulai ada kekhawatiran terhadap Mujab Fahmi.	Muhammad Jam dan Muhammad Khi-rom mulai ada kekhawatiran terhadap Mujab Fahmi.
6_111	Muhammad Nurlif diadili sesuai fakta hukum.	Muhammad Nur-lif diadili sesuai fakta hukum.
6_112	Muhammad Taufiq Abda dapat dipercaya sesuai namanya.	Muhammad Tau-fiq Ab-da dapat dipercaya sesuai namanya.
6_113	Muhammad Yus bekerja sesuai dokumen tender.	Muhammad Yus bekerja sesuai dokumEn tEnder.
6_114	Mulai dari perbatasan Kanada sampai Florida.	Mulai dari perbatasan Kanada sampai Florida.
6_115	Mulai Jumat sepupu Eric akan menginap.	Mulai Jumat sepupu Erik akan menginap.
6_116	Mulai Rabu sepuluh anggota akan datang.	Mulai Rabu sepuluh anggota akan datang.
6_117	Mulai Senin pagi, urusan administrasi sesuai kontrak.	Mulai Senin pagi, urusan administrasi sesuai kontrak.
6_118	Mungkin ada oknum Bea Cukai yang terlibat.	Mungkin ada oknum BEa Cukai yang terlibat.
6_119	Mungkin Danyon mulai melenceng.	Mungkin Danyon mulai melEncEng.
6_120	Mungkin saja, proses mandeg sampai di DPR.	Mungkin saja, prosEs mandeg sampai di DE-PE-ER.
6_121	Mungkin sedikit syukuran.	Mungkin sedikit syukuran.
6_122	Mungkin tarif tolnya turun.	Mungkin tarif tolnya turun.
6_123	Mungkinkah kelar minggu ini?	Mungkinkah kelar minggu ini?
6_124	Mungkinkah rampung minggu ini?	Mungkinkah rampung minggu ini?
6_125	Mungkinkah selesai minggu ini?	Mungkinkah selesai minggu ini?
6_126	Murid Madrasah Tsanawiyah tewas.	Murid Madrasah Tsanawiyah tEwas.
6_127	Musibah Gunung Slamet jenazah Iis ditemukan.	Musibah Gunung Slamet, jenazah Iis ditemukan.
6_128	Najib Nawir, Mursyid Amal, dan Mullah Fazil mengikuti Musyawarah Nasional Teknik.	Na-jib Na-wir, Mur-syid Amal, dan Mul-lah Fa-zil mengikuti Musyawarah Na-si-o-nal tEknik.
6_129	Nama anda siapa?	Nama anda siapa?
6_130	Nama bayi itu Mustofa Ali.	Nama bayi itu Mus-to-fa Ali.
6_131	Nama beken yang tercantum dalam keterangan Sekneg tadi.	Nama bekEn yang tercantum dalam keterangan SEk-nEg tadi.
6_132	Nama kamu siapa?	Nama kamu siapa?
6_133	Namamu siapa pelayan Owen yang baik?	Namamu siapa, pelayan Owen yang baik?
6_134	Namun detailnya untuk jangka pendek FPDIP untung.	Namun de-ta-ilnya untuk jangka pEndEk EF-PE-DE-I-PE untung.
6_135	Namun di lapangan Bintang Kejora dipakai sebagai wujud negara, ujarnya.	Namun di lapangan Bintang Kejora dipakai sebagai wujud negara, ujarnya.
6_136	Namun dia enggan menjelaskan siapa yang membuat konsep fatwa tersebut.	Namun dia enggan menjelaskan siapa yang membuat konsEp fatwa tersebut.
6_137	Namun Fariz sudah lama tidak bertemu Taufik, karena kesibukan masing-masing.	Namun Fariz sudah lama tidak bertemu Taufik, karena kesibukan masing-masing.
6_138	Namun isu ini dibantah Mayjen Nurfaizi karna membutuhkan survei lebih lanjut.	Namun isu ini dibantah MayjEn Nurfaizi karna membutuhkan survEi lebih lanjut.
6_139	Namun kali ini disela-sela suara setuju itu terdengar teriakan-teriakan, Hei.	Namun kali ini disela-sela suara setuju itu terdengar teriakan-teriakan, HEi!
6_140	Namun konvoi itu diarahkan aparat ke Gedung Negara Grahadi.	Namun konvoi itu diarahkan aparat ke Gedung Negara Gra-ha-di.
6_141	Namun Majelis Hakim tetap memerintahkan agar saksi Entoy tetap dipanggil.	Namun Majelis Hakim tetap memerintahkan agar saksi entoy tetap dipanggil.
6_142	Namun mekanisme untuk mengontrolnya tidak ada lagi.	Namun mEkanisme untuk mengontrolnya tidak ada lagi.
6_143	Namun Owen sempat berkelit karena senewen dan takut cucunya terluka.	Namun Owen sempat berkelit karena senEwen dan takut cucunya terluka.
6_144	Namun pabrik minyak gorengnya hanya memiliki dua lampu warna merah dan hijau.	Namun pabrik minyak gorEngnya hanya memiliki dua lampu warna mErah dan hijau.
6_145	Namun panggung terbuka di tepi danau tetap menunjukkan roh Wianta.	Namun panggung terbuka di tepi danau tetap menunjukkan roh Wi-yan-ta.
6_146	Namun Saleh tak memperinci fasilitas umum apa yang rusak.	Namun SalEh tak memperinci fasilitas umum apa yang rusak.
6_147	Namun sebagian lain menuntut butir kesepakatan itu ditulis blak-blakan.	Namun sebagian lain menuntut butir kesepakatan itu ditulis blak-bla-kan.
6_148	Namun selama babak penyisihan grup Zona Eropa malah mengacaukan.	Namun selama babak penyisihan grup Zona Eropa malah mengacaukan.
6_149	Namun Tarigan tidak memeriksa lebih lanjut sebab khawatir akan meledak.	Namun Ta-ri-gan tidak memeriksa lebih lanjut sebab khawatir akan meledak.
6_150	Namun, akhirnya Nur mengaku khilaf pada peringatan Maulid Nabi ini.	Namun, akhirnya Nur mengaku khilaf pada peringatan Maulid Nabi ini.
6_151	Namun, Alfred tidak beruntung pada kedua partai catur cepat itu.	Namun, AlfrEd tidak beruntung pada kedua partai catur cepat itu.
6_152	Namun, diduga, pertemuan Arafat-Powell digelar hari Minggu ini.	Namun, diduga, pertemuan A-ra-fat-Po-well digelar hari Minggu ini.
6_153	Namun, karena ada prasangka, akhirnya Pansus Buloggate pun dibentuk.	Namun, karena ada prasangka, akhirnya Pansus Bu-log-gE-it pun dibentuk.
6_154	Namun, lanjut dia, pailit tetap dijatuhkan.	Namun, lanjut dia, pailit tetap dijatuhkan.
6_155	Namun, Mahfud tidak menjelaskan secara detail hasil yang ia maksud.	Namun, Mah-fud tidak menjelaskan secara de-ta-il hasil yang ia maksud.
6_156	Namun, mereka tetap menanyakan uang tunai lainnya, plus AC, plus saldo giro.	Namun, MerEka tetap menanyakan uang tunai lainnya, plus A-SE, plus saldo giro.
6_157	Namun, mulai Maret hingga Mei pertemuan kerjasama dengan para rekanan akan normal.	Namun, mulai Maret hingga mEi pertemuan kerjasama dengan para rekanan akan normal.
6_158	Namun, pasangan Denmark tidak melayani dan selalu memperlambat tempo permainan.	Namun, pasangan DEnmark tidak melayani dan selalu memperlambat tEmpo permainan.
6_159	Namun, Pradjoto khawatir UUD yang terlampau rinci, juga akan membingungkan.	Namun, Pra-joto khawatir U-U-DE yang terlampau rinci, juga akan membingungkan.
6_160	Namun, Susilo enggak merinci persyaratan platform yang dia maksud itu.	Namun, Susilo engga merinci persyaratan plat-form yang dia maksud itu.
6_161	Namun, tampaknya Australia menempati ruang khusus di relung hati Tahija.	Namun, tampaknya Aus-tra-lia menempati ruang khusus di relung hati Ta-hi-ja.
6_162	Namun, Yusuf enggan menjelaskan identitas dua tahanan itu kepada Pers nasional.	Namun, Yusuf enggan menjelaskan idEntitas dua tahanan itu kepada PErs nasional.
6_163	Nano orangnya itu ramah, pinter ngomong dan mengutamakan persaingan sehat.	Nano orangnya itu ramah, pinter ngomong dan mengutamakan persaingan sEhat.
6_164	Nanti akan diresmikan penggunaannya kalau sudah selesai empat lantai.	Nanti akan diresmikan penggunaannya kalau sudah selesai empat lantai.
6_165	Nanti saya kasih tahu Egi Peralatan dari korps zeni.	Nanti saya kasih tahu Egi Peralatan dari korps zEni.
6_166	Nasib empat mantan juara yang gendut itu tidak jelas.	Nasib empat mantan juara yang gendut itu tidak jelas.
6_167	Nasib negara tidak hanya ditentukan oleh pihak eksekutif saja.	Nasib negara tidak hanya ditentukan olEh pihak EksEkutif saja.
6_168	Negara kita seperti negara koboi saja.	Negara kita seperti negara koboi saja.
6_169	Negara Maju Bereaksi Atas Penolakan AS ke Protokol Kyoto.	Negara Maju BerEaksi Atas Penolakan A-ES ke Protokol Ki-yo-to.
6_170	Ngapain ngurusin darurat militer atau sipil.	Ngapain ngurusin darurat militEr atau sipil.
6_171	Ngeri deh, satu pucuk wolter rakitan dan satu clurit disita.	Ngeri dEh, satu pucuk wolter rakitan dan satu clurit disita.
6_172	Ngeri lho sekujur tubuh Ngatiyem hangus, sehelai seprei menutup badannya.	Ngeri lho sekujur tubuh Ngatiyem hangus, sehElai seprEi menutup badannya.
6_173	Ngomongnya ke anak-anak juga benar.	Ngomongnya ke anak-anak juga benar.
6_174	Ngurah Santosa meramal nasib Ichwan, pegawai kontraktor yang tak terurus.	Ngurah Santosa meramal nasib Ikhwan, pegawai kontraktor yang tak terurus.
6_175	Nilai-nilai Orde Baru itu sasarannya tidak tepat ini tidak benar tapi tidak bisa dianggap remeh.	Nilai-nilai Orde Baru itu sasarannya tidak tepat, ini tidak benar, tapi tidak bisa dianggap rEmEh.
6_176	Nomer akses layanan audioconference adalah Sembilan nol lima dua lima tiga lima empat lima lima.	Nomer aksEs layanan audiokonferens adalah sembilan nol lima dua lima tiga lima empat lima lima.
6_177	Nomer konferensi itu apa?	Nomer konferEnsi itu apa?
6_178	Nomer konferensinya nol nol satu titik nol sembilan titik tiga puluh dua.	Nomer konferEnsinya nol nol satu titik nol sembilan titik tiga puluh dua.
6_179	Nomer moderator itu apa?	Nomer moderator itu apa?
6_180	Nomer moderatornya nol delapan tiga kosong tiga satu.	Nomer moderatornya nol delapan tiga kosong tiga satu.
6_181	Nomer partisipan itu apa, nomer partisipasi itu apa?	Nomer partisipan itu apa, nomer partisipasi itu apa?
6_182	Nomer partisipasi nol dua titik nol empat titik nol enam titik tiga ratus dua.	Nomer partisipasi nol dua titik nol empat titik nol enam titik tiga ratus dua.
6_183	Nomernya dua dua kosong satu empat tujuh lima lima satu lima kali.	Nomernya dua dua kosong satu empat tujuh lima lima satu lima kali.
6_184	Nomernya nol tiga tujuh titik, nol nol titik berapa ya?	Nomernya nol tiga tujuh titik, nol nol titik berapa ya?
6_185	Nomor telfon kantor pelayanan PT Elektrindo Nusantara berapa?	Nomor telfon kantor pelayanan PE-TE ElEktrindo Nusantara berapa?
