4_001	Prof Dr Jimly Asshiddiqie terpilih sebagai ketua umum Ikatan Cendekiawan Muslim Indonesia atau ICMI.	Prof DE-Er Jimli As-shid-diq terpilih sebagai ketua umum Ikatan Cendekiawan Muslim IndonEsia atau ICMI.
4_002	Jimly Asshiddiqie juga merupakan ketua Dewan Kehormatan Penyelenggara Pemilu atau DKPP.	Jimli As-shid-diq juga merupakan ketua dEwan Kehormatan Penyelenggara Pemilu atau DE-KA-PE-PE.
4_003	Pemilihan ketua umum dilakukan secara musyawarah mufakat di antara tujuh formatur yang terpilih.	Pemilihan ketua umum dilakukan secara musyawarah mufakat di antara tujuh formatur yang terpilih.
4_004	"Ketujuh formatur itu adalah Ilham Habibie, Jimly Asshiddiqie, Zulkifli Hasan, Priyo Budi Santoso, Muhammad Nuh, Herry  Suhardiyanto dan Hatta Rajasa."	"Ketujuh formatur itu adalah Ilham Habibi, Jimli As-shid-diq, Zulkifli Hasan, Priyo Budi Santoso, Muhammad Nuh, Her-ri  Suhardiyanto dan Hat-ta Rajasa."
4_005	"Pemilihan diawali dengan usulan nama dari peserta Muktamar Orwil, Orda, Orsat yang dibawa ke Majelis Permusyawaratan Muktamar."	"Pemilihan diawali dengan usulan nama dari peserta Muktamar Orwil, Orda, Orsat yang dibawa ke Majelis Permusyawaratan Muktamar."
4_006	"Anggota Majelis Permusyawaratan Muktamar adalah presidium demisioner, ketua dewan penasihat, ketua dewan pakar."	"Anggota Majelis Permusyawaratan Muktamar adalah prEsidium dEmisionEr, ketua dEwan penasihat, ketua dEwan pakar."
4_007	"Dengan ICMI, Indonesia sebagai model Islam yang rahmatan lil alamin menjadi model bagi negara-negara lain."	"Dengan ICMI, IndonEsia sebagai modEl Islam yang rahmatan lil alamin menjadi modEl bagi negara-negara lain."
4_008	"Wakil Ketua MPR Oesman Sapta memberi sambutan dalam Rakernas APERSI tanggal dua belas Desember dua ribu lima belas di Makassar, Sulawesi Selatan."	"Wakil Ketua EM-PE-ER Usman Sapta memberi sambutan dalam Rakernas apErsi tanggal dua belas DEsEmber dua ribu lima belas di Makassar, Sulawesi Selatan."
4_009	"Dikatakan Oesman Sapta bahwa saat ini seluruh masyarakat apakah itu pegawai negeri, anggota Polri dan TNI membutuhkan rumah."	"Dikatakan Usman Sapta bahwa saat ini seluruh masyarakat apakah itu pegawai negeri, anggota Polri dan TE-EN-I membutuhkan rumah."
4_010	Ketua APERSI Edy Ganefo mengatakan pengembang rumah yang bernaung di organisasinya mencapai emapt ribu pengusaha.	Ketua apErsi Edi GanEfo mengatakan pengembang rumah yang bernaung di organisasinya mencapai empat ribu pengusaha.
4_011	Panglima TNI Jenderal Gatot Nurmantyo mengungkapkan pada masa lalu ada kerajaan besar di nusantara seperti Sriwijaya dan Majapahit namun kerajaan itu punah.	Panglima TE-EN-I jEnderal Gatot Nurmantyo mengungkapkan pada masa lalu ada kerajaan besar di nusantara seperti Sriwijaya dan Majapahit namun kerajaan itu punah.
4_012	"Diungkapkan negara-negara di kawasan equator seperti Indonesia, Afrika Tengah, Ghana, Brasil, dan lain sebagainya memiliki masa tanam yang panjang dan subur."	"Diungkapkan negara-negara di kawasan Ekuator seperti IndonEsia, Afrika Tengah, Ghana, Brasil, dan lain sebagainya memiliki masa tanam yang panjang dan subur."
4_013	Seni budaya adalah karakter banga Indonesia yang sangat khas.	Seni budaya adalah karakter banga IndonEsia yang sangat khas.
4_014	Akulturasi budaya satu daerah dan daerah lainnya sangat kuat dan saling mengisi membentuk ke-Bhinneka-an Indonesia.	Akulturasi budaya satu daErah dan daErah lainnya sangat kuat dan saling mengisi membentuk ke-BhinnEka-an IndonEsia.
4_015	MPR RI melakukan gerakan Sosialisasi empat pilar MPR RI.	EM-PE-ER ER-I melakukan gerakan sosialisasi empat pilar EM-PE-ER ER-I.
4_016	Pancasila sebagai dasar dan ideologi negara.	Pancasila sebagai dasar dan idEologi negara.
4_017	UUD NRI Tahun 1945 sebagai konstitusi negara.	U-U-DE EN-ER-I Tahun 1945 sebagai konstitusi negara.
4_018	NKRI sebagai bentuk negara.	EN-KA-ER-I sebagai bentuk negara.
4_019	Bhinneka Tunggal Ika sebagai semboyan negara.	BhinnEka Tunggal Ika sebagai semboyan negara.
4_020	Di tanah  Melayu ini akulturasi sosial dan budaya sangat tinggi terutama akulturasi budaya Melayu dan Jawa.	Di tanah  Melayu ini akulturasi sosial dan budaya sangat tinggi terutama akulturasi budaya Melayu dan Jawa.
4_021	"Menurut Raman, desa Bayas Jaya terdiri dari lima dusun yakni Dusun Jasa Usaha, Dusun Jasa Tani, Dusun Jasa Karya, Dusun Jaya Karya dan Dusun Jasa Rukun."	"Menurut Raman, dEsa Bayas Jaya terdiri dari lima dusun yakni Dusun Jasa Usaha, Dusun Jasa Tani, Dusun Jasa Karya, Dusun Jaya Karya dan Dusun Jasa Rukun."
4_022	Bahkan Sri Kresna sendiri berkoalisi dengan para dewa untuk menggagalkan rencana Semar.	Bahkan Sri KrEsna sendiri berkoalisi dengan para dEwa untuk menggagalkan rencana Semar.
4_023	Mau tidak mau para Pandawa mengikuti keinginan Sri Kresna.	Mau tidak mau para Pandawa mengikuti keinginan Sri KrEsna.
4_024	Hanya Sadewa yang menentang Sri Kresna dan saudara-saudaranya.	Hanya SadEwa yang menentang Sri KrEsna dan saudara-saudaranya.
4_025	"Kisah Semar Mbangun Kahyangan, adalah sebuah bentuk edukasi moral."	"Kisah Semar eM-bangun Kahyangan, adalah sebuah bentuk Edukasi moral."
4_026	"Ketua MPR Zulkifli Hasan, di ruang kerjanya Gedung Nusantara III Komplek Gedung MPR menerima Duta Besar Ceko untuk Indonesia, Ivan Hotek."	"Ketua EM-PE-ER Zulkifli Hasan, di ruang kerjanya Gedung Nusantara tiga KomplEk Gedung EM-PE-ER menerima Duta Besar CEko untuk IndonEsia, Ivan HotEk."
4_027	"Wayang Kulit Satria Pinilih hibur warga Kenduruan, Tuban."	"Wayang Kulit Satria Pinilih hibur warga Kenduruan, Tuban."
4_028	Pemikiran Bung Karno dianggap sebagai sintesis antara Islam dan nasionalisme.	Pemikiran Bung Karno dianggap sebagai sintEsis antara Islam dan nasionalisme.
4_029	Bung Karno dikenal luas sebagai seorang pemikir dan ideolog bangsa dengan pemikiran yang sangat komprehensif.	Bung Karno dikenal luas sebagai seorang pemikir dan idEolog bangsa dengan pemikiran yang sangat kom-pre-hEn-sif.
4_030	Ketua PP Muhammadiyah Hajriyanto Y Tohari merupakan salah seorang pembicara dalam seminar itu.	Ketua PEPE Muhammadiyah Hajriyanto YE Tohari merupakan salah seorang pembicara dalam seminar itu.
4_031	Pembentukan Panitia 9 oleh Bung Karno melahirkan Piagam Jakarta dua puluh dua Juni seribu sembilan ratus empat puluh lima.	Pembentukan Panitia 9 oleh Bung Karno melahirkan Piagam Jakarta dua puluh dua Juni seribu sembilan ratus empat puluh lima.
4_032	Tulisan-tulisan Islam Bung Karno juga sangat progresif dan berkemajuan.	Tulisan-tulisan Islam Bung Karno juga sangat progrEsif dan berkemajuan.
4_033	Doa menandai dimulainya acara pembukaan pagelaran wayang kulit di Kabupaten tempat Sunan Bonang dimakamkan.	Doa menandai dimulainya acara pembukaan pagelaran wayang kulit di KabupatEn tempat Sunan Bonang dimakamkan.
4_034	Acara dilanjutkan dengan Sambutan Bupati Tuban yang diwakili oleh Asisten Sekda bidang Perekonomian Sulistyadi.	Acara dilanjutkan dengan sambutan Bupati Tuban yang diwakili olEh AsistEn SEkda bidang PerEkonomian Sulistyadi.
4_035	Hal yang sama juga disampaikan oleh Ana Muawanah Pimpinan Fraksi PKB MPR RI yang dalam kesempatan ini mewakili Pimpinan MPR.	Hal yang sama juga disampaikan olEh Ana Muawanah Pimpinan Fraksi PE-KA-BE EM-PE-ER ER-I yang dalam kesempatan ini mewakili Pimpinan EM-PE-ER.
4_036	Lakon Satria Pinilih dimainkan oleh dalang Ki Sigid Ariyanto dari Rembang.	Lakon Satria Pinilih dimainkan oleh dalang Ki Sigid Ariyanto dari Rembang.
4_037	Lakon Satria Pinilih mengisahkan tentang negeri kayangan yang sedang dilanda kerusuhan.	Lakon Satria Pinilih mengisahkan tentang negeri kayangan yang sedang dilanda kerusuhan.
4_038	Pagelaran yang dipenuhi sesak oleh penonton ini juga dihadiri oleh Didik Mukrianto Pimpinan Fraksi Partai Demokrat MPR RI.	Pagelaran yang dipenuhi sesak oleh penonton ini juga dihadiri oleh Didik Mukrianto Pimpinan Fraksi Partai DEmokrat EM-PE-ER ER-I.
4_039	"Turut hadir Wihadi Wiyanto Pimpinan Fraksi Partai Gerindra MPR RI, Kapolres Tuban, SKPD dan Forkompinda Tuban dan para Camat di Kabupaten Tuban."	"Turut hadir Wihadi Wiyanto Pimpinan Fraksi Partai Gerindra EM-PE-ER ER-I, KapolrEs Tuban, ES-KA-PE-DE dan Forkompinda Tuban dan para Camat di KabupatEn Tuban."
4_040	"Dr. H.C. Zulkifli Hasan, S.E., M.M. sebagai Ketua MPR RI dari Fraksi Partai Amanat Nasional."	DE-Er HA-CE  Zulkifli Hasan ES-E  EM-EM sebagai Ketua EM-PE-ER ER-I dari Fraksi Partai Amanat Nasional.
4_041	"H. Mahyudin, S.T., M.M. menjabat sebagai Wakil Ketua MPR RI dari Fraksi Golkar."	HA Mahyudin ES-TE EM-EM menjabat sebagai Wakil Ketua EM-PE-ER ER-I dari Fraksi Partai Golkar.
4_042	"Evert Ernest  Mangindaan, S.IP. sebagai Wakil Ketua MPR RI Fraksi Partai Demokrat."	"Evert Ernest  Mangindaan, ES-IPE sebagai Wakil Ketua EM-PE-ER ER-I Fraksi Partai Demokrat."
4_043	"Dr. H.M. Hidayat Nur Wahid, M.A. merupakan Wakil Ketua MPR RI dan berasal dari Fraksi Partai Keadilan Sejahtera."	DE-Er HA EM Hidayat Nur Wahid EM-A merupakan Wakil Ketua EM-PE-ER ER-I dan berasal dari Fraksi Partai Keadilan Sejahtera.
4_044	Meningkatnya hubungan antar parlemen akan mendukung kerja sama hubungan antar pemerintah.	Meningkatnya hubungan antar parlemEn akan mendukung kerja sama hubungan antar pemerintah.
4_045	Dr. H.C. Oesman Sapta merupakan Wakil Ketua MPR RI Kelompok DPD di MPR RI.	DE-Er HA-CE Usman Sapta merupakan Wakil Ketua EM-PE-ER ER-I Kelompok DE-PE-DE di EM-PE-ER ER-I.
4_046	Tidak ada revisi terhadap rencana strategis Majelis dan Sekretariat Jenderal MPR RI.	Tidak ada revisi terhadap rencana strategis Majelis dan Sekretariat jEnderal EM-PE-ER ER-I.
4_047	Sambutan Sekretaris Jenderal pada Panel dua dan tiga Penilaian Mandiri Pelaksanaan Reformasi Birokrasi atau PMPRB.	Sambutan SekrEtaris jEnderal pada PanEl dua dan tiga Penilaian Mandiri Pelaksanaan REformasi Birokrasi atau PE-EM-PE-ER-BE.
4_048	"Laporan Ketua Panitia Monev, Evaluasi dan Pelaporan Reformasi Birokrasi Setjen MPR."	"Laporan Ketua Panitia MonEv, Evaluasi dan Pelaporan REformasi Birokrasi SEtjEn EM-PE-ER."
4_049	Ketua MPR Zulkifli Hasan berharap pemerintah mengambil alih Freeport Indonesia.	Ketua EM-PE-ER Zulkifli Hasan berharap pemerintah mengambil alih Fri-port IndonEsia.
4_050	"Budaya Melayu merupakan budaya adiluhung ujar Ketua Fraksi PPP di MPR, Irgan Chairul Mahfiz."	"Budaya Melayu merupakan budaya adiluhung ujar Ketua Fraksi PE-PE-PE di EM-PE-ER, Irgan Hairul Mahfiz."
4_051	"Kini, mereka tengah menyocokkan data."	"Kini, merEka tengah menyocokkan data."
4_052	"Kini, rezeki itu menghilang mengikuti pemindahan pasar ke Oebobo."	"Kini, rezeki itu menghilang mengikuti pemindahan pasar ke Ubobo."
4_053	Kita bisa bertindak bersama-sama asal berlaku ikhlas dan jujur.	Kita bisa bertindak bersama-sama asal berlaku ikhlas dan jujur.
4_054	Kita imbau supaya tarif tetap normal selama Pesta Rakyat.	Kita imbau supaya tarif tetap normal selama PEsta Rakyat.
4_055	Kita objektif kok kilah Zein.	Kita objEktif kok kilah ZEin.
4_056	Kita sudah sampai ngedrop nasi segala.	Kita sudah sampai ngedrop nasi segala.
4_057	"Kita tidak mau kacau lagi, sudah cukup."	"Kita tidak mau kacau lagi, sudah cukup."
4_058	Klaim asuransi akibat banjir tidak akan mengganggu likuiditas perseroan.	Klaim asuransi akibat banjir tidak akan mengganggu li-ku-i-ditas persEroan.
4_059	Klaim jamaah bisa ditujukan maktab atau juga Depag.	Klaim jamaah bisa ditujukan maktab atau juga DEpag.
4_060	Klaim Philipina pun ditolak kata warga Inggris Mike Smith.	Klaim Filipina pun ditolak kata warga Inggris Maik Smith.
4_061	Klaim tunai atau polis maturasi jawab Hamzah cepat.	Klaim tunai atau polis maturasi jawab Hamzah cepat.
4_062	Klub Gudang Garam melawan Klub Yunani.	Klub Gudang Garam melawan Klub Yunani.
4_063	Klub-klub Jerman tidak pernah menyerah sebelum peluit akhir.	Klub-klub JErman tidak pernah menyerah sebelum peluit akhir.
4_064	Kodam brawijaya dan Kodam siliwangi melakukan apel pagi.	Kodam brawijaya dan Kodam siliwangi melakukan apEl pagi.
4_065	Koizumi akan kerja sama secara erat.	Koizumi akan kerja sama secara erat.
4_066	Kok lama sekali? Ujar Komisaris Besar Adang Rochjana.	Kok lama sekali? Ujar Komisaris Besar Adang Roh-jana.
4_067	Kok nggak ditangkap ujar Kolonel Choirudin Aziz.	Kok nggak ditangkap ujar KolonEl Hoirudin Aziz.
4_068	Kok wartawan kalau ngecek cuma di tempat ini saja Kata Bazrif.	Kok wartawan kalau nge-cEk cuma di tempat ini saja Kata Bazrif.
4_069	Kolusi dan nepotisme Orde Baru pada Komando daerah militer.	Kolusi dan nEpotisme Orde Baru pada Komando daErah militEr.
4_070	"Komite apa namanya, Komite Jaringan Islah."	"Komite apa namanya, Komite Jaringan Islah."
4_071	Komite Wilayah Benteng Muda Indonesia mendukung Propinsi Riau.	Komite Wilayah BEntEng Muda IndonEsia mendukung Propinsi Riau.
4_072	Kompyang Raka menggelar konser di Kompleks Lippo Cikarang mulai jam dua sore.	Kompyang Raka menggelar konsEr di KomplEks Lippo Cikarang mulai jam dua sorE.
4_073	Kondisi sekarang jauh dibanding saat saya masuk kerja empat tahun lalu.	Kondisi sekarang jauh dibanding saat saya masuk kerja empat tahun lalu.
4_074	Konflik terjadi di Maluku ataupun di Mindanao antara orang-orang Moro dengan orang-orang Filipina.	Konflik terjadi di Maluku ataupun di Mindanao antara orang-orang Moro dengan orang-orang Filipina.
4_075	Korem Wirabhakti perbaiki citra instansinya di empat kecamatan.	KorEm Wirabhakti perbaiki citra instansinya di empat kecamatan.
4_076	Kota Lubulinggau di Sumatera Selatan merupakan tempat kelahiran Riza Chalid.	Kota Lubulinggau di Sumatera Selatan merupakan tempat kelahiran Riza Halid.
4_077	KTP dengan nomor kosong dua kosong tiga bisa selesai berapa hari lagi?	KA-TE-PE dengan nomor kosong dua kosong tiga bisa selesai berapa hari lagi?
4_078	Kubu Taliban mengklaim garnisun yang diserang AS itu kosong.	Kubu Taliban mengklaim garnisun yang diserang A-ES itu kosong.
4_079	Kue cincin berwarna kuning cerah kata Gonzales.	KuE cincin berwarna kuning cerah kata GonzalEs.
4_080	Kue ekonomi tidak dibagi secara adil kutip Baramuli.	KuE Ekonomi tidak dibagi secara adil kutip Baramuli.
4_081	Kurang benar kutip Deny.	Kurang benar kutip DEni.
4_082	Mari bertemu di kamar Kosong delapan kosong sembilan pada jam delapan.	Mari bertemu di kamar Kosong delapan kosong sembilan pada jam delapan.
4_083	Masyarakat cukup kritis menanggapi menjamurnya cowok jadi-jadian.	Masyarakat cukup kritis menanggapi menjamurnya cowok jadi-jadian.
4_084	Meluapnya air juga akibat tertutupnya muara sungai oleh lumpur.	Meluapnya air juga akibat tertutupnya muara sungai olEh lumpur.
4_085	Menjamurnya makanan instans menjadi faktor penyebab terus meningkatnya bayi kurang gizi.	Menjamurnya makanan instans menjadi faktor penyebab terus meningkatnya bayi kurang gizi.
4_086	Mike Tyson KO hanya sesaat setelah wasit Meier meniup tanda dimulainya duel.	Maik Tison KA-O hanya sesaat setelah wasit ME-yer meniup tanda dimulainya duEl.
4_087	Mohon info kartu keluarga Ibu Emmy.	Mohon info kartu keluarga Ibu Em-mi.
4_088	Pansus Bulog DPR ditugaskan untuk menangani kasus Buloggate dan Bruneigate.	Pansus Bulog DE-PE-ER ditugaskan untuk menangani kasus Bu-log-gEit dan Brunei-gEit.
4_089	Pelanggaran Kode etik pegawai dan Kode HAM.	Pelanggaran Kode Etik pegawai dan Kode HAM.
4_090	Rencananya besok siang Erwin dibawa ke RSCM guna memperoleh perawatan.	Rencananya bEsok siang Erwin dibawa ke ER-ES-CE-EM guna memperolEh perawatan.
4_091	Seingat Chotibul Informasi syarat-syarat KTP ada tiga.	"Seingat khotibul, informasi syarat-syarat KA-TE-PE ada tiga."
4_092	"Selain Harvey Malaiholo, juga ada penyanyi Edy Silitonga."	"Selain Har-vey Ma-lai-ho-lo, juga ada penyanyi Edi Silitonga."
4_093	Semua agama di nusantara berada di bawah Depag kecuali agama Budha.	Semua agama di nusantara berada di bawah DEpag kecuali agama Budha.
4_094	Setya Novanto khawatir perubahan undang undang akan mengacaukan negara.	Setya Novanto khawatir perubahan undang undang akan mengacaukan negara.
4_095	Sidang menghadirkan Suaib dan mantan Kabulog Yusuf Kalla sebagai saksi.	Sidang menghadirkan Su-aib dan mantan Kabulog Yusuf Kalla sebagai saksi.
4_096	Syed Hamid terbang Ke Aceh Kata Yuzril.	SyEd Hamid terbang Ke AcEh Kata Yuzril.
4_097	Tahun ini berbeda dengan tahun sebelumnya yang menggunakan soal dengan huruf braile.	Tahun ini berbEda dengan tahun sebelumnya yang menggunakan soal dengan huruf braile.
4_098	Ujar dinas lalu lintas kepolisian di Ungaran jam dua puluh tiga tadi malam.	Ujar dinas lalu lintas kepolisian di Ungaran jam dua puluh tiga tadi malam.
4_099	Uskup Gereja Katolik Leo Agung membaptis bayi Hino Biohanis.	Uskup GerEja Katolik LEo Agung membaptis bayi Hino Biohanis.
4_100	"Walaupun Gus Dur ngawur, Gus Dur nggak mungkin mau mundur."	"Walaupun Gus Dur ngawur, Gus Dur engga mungkin mau mundur."
4_101	Abdurrahman Wahid rencananya akan berangkat ke AS jam lima tepat esok sore.	Ab-dur-rah-man Wa-hid rencananya akan berangkat ke A-ES jam lima tepat Esok sorE.
4_102	Acara Selasa sore dan Rabu sore jam lima pas yaitu Khazanah Wayang .	"Acara Selasa sorE dan Rabu sorE jam lima pas yaitu, Khazanah Wayang."
4_103	Ada penyuluhan yaitu di Posyandu Selasa pagi.	Ada penyuluhan yaitu di Posyandu Selasa pagi.
4_104	Ahli pengetahuan tentang psikotropika yaitu Kosgoro yang dikenal sebagai Mike.	Ahli pengetahuan tentang psi-ko-tro-pi-ka yaitu Kosgoro yang dikenal sebagai Maik.
4_105	"Amazon, Cideng, Masio, Panas, Raya itu nama-nama sungai."	"Amazon, Cideng, Ma-si-yo, Panas, Raya itu nama-nama sungai."
4_106	Apa tujuan kamu mempublikasikan foto atau sketsa para tersangka?	Apa tujuan kamu mempublikasikan foto atau skEtsa para tersangka?
4_107	Bacillus anthracis yakni sebuah bakteri yang masuk dalam spesies anthrax.	Ba-si-lus an-tra-kis yakni sebuah baktEri yang masuk dalam spesiEs an-traks.
4_108	Banjir melanda warga Ciledug Tangerang dan warga Dayeuhkolot.	Banjir melanda warga Ciledug Tangerang dan warga Da-yeuh-kolot.
4_109	"Beliau tidak menyebut-nyebut wapresnya, seloroh Hasyim."	"Beliau tidak menyebut-nyebut waprEsnya, seloroh Hasyim."
4_110	Bom Batam sembilan pagi ini tersangkanya bernama Machmud.	Bom Batam sembilan pagi ini tersangkanya bernama Mahmud.
4_111	Ceramah Yusuf Syakir disiarkan langsung oleh radio Elshinta.	Ceramah Yusuf Sya-kir disiarkan langsung olEh radio El-shin-ta.
4_112	Dia punya wewenang selaku Mensesneg waktu itu.	Dia punya wewenang selaku MEnsEsnEg waktu itu.
4_113	Diputuskan pimpinan Polwiltabes jawa barat yaitu Febi Widhiyanto melalui hasil rapat pleno.	Diputuskan pimpinan Polwiltabes jawa barat yaitu FEbi Wi-dhi-yan-to melalui hasil rapat plEno.
4_114	Ia datang sekadar untuk mengambil wudu tanpa memberi salam atau ucapan lain.	Ia datang sekadar untuk mengambil wudu tanpa memberi salam atau ucapan lain.
4_115	Ini ulah spekulan Ongko Grup ujar Rusdiharjo enteng.	"Ini ulah spEkulan Ongko Grup, ujar Rus-di-har-jo EntEng."
4_116	Kecelakaan dengan posisi pesawat nyungsep pukul sembilan pas di Mutih wetan.	Kecelakaan dengan posisi pesawat nyungsep pukul sembilan pas di Mutih wEtan.
4_117	La Ode Nufail lagi bandel-bandelnya.	La OdE Nufail lagi bandel-bandelnya.
4_118	"Lagi capek saja jalan dari Lantai enam ke lantai satu, lanjut Hong."	"Lagi capEk saja, jalan dari lantai enam ke lantai satu, lanjut Hong."
4_119	"Lagi, Trantib buldozer tempat cuci mobil."	"Lagi, Trantib buldozer tempat cuci mobil."
4_120	"Lain lagi klaim GAM, lanjut Taufiq."	"Lain lagi klaim GAM, lanjut Taufiq."
4_121	Laju ekonomi tergantung kabinet mendatang seperti dikutip Yusuf Hasyim.	"Laju Ekonomi tergantung kabinEt mendatang, seperti dikutip Yusuf Ha-syim."
4_122	Laksamana Pertama Sugeng Waluyo seperti membuang imej yang terlanjur ada sesal Jehalim.	"Laksamana Pertama Sugeng Waluyo seperti membuang imEj yang terlanjur ada, sesal Jehalim."
4_123	"Lalu dengan itu, diam-diam kita yang nyinyir merasa tersindir."	"Lalu dengan itu, diam-diam kita yang nyinyir merasa tersindir."
4_124	Lalu dibawa ke Brimob Kelapa Dua lanjut Sri.	"Lalu dibawa ke Brimob Kelapa Dua, lanjut Sri."
4_125	"Lalu faktor harga, lalu saham Bayer, seperti yang diminta IMF sebagai syaratnya."	"Lalu faktor harga, lalu saham Bayer seperti yang diminta I-EM-EF sebagai syaratnya."
4_126	Lalu langkah ke empat dia mulai ngebut.	Lalu langkah ke empat dia mulai ngebut.
4_127	Lalu mengapa Suyono bersikeras bahwa Syarwan dan Hartono terlibat?	Lalu mengapa Suyono bersikeras bahwa Syar-wan dan Hartono terlibat?
4_128	Lalu mereka ceburkan ke sumur tutur Cholil lagi.	"Lalu mereka ceburkan ke sumur, tutur Cholil lagi."
4_129	"Lalu, tiga Brimob cidera diserang sepuluh ribu GAM."	"Lalu, tiga Brimob cidera diserang sepuluh ribu GAM."
4_130	Lama juga ya seribu satu Laskar Jihad Hendak Dipulangkan?	Lama juga ya seribu satu Laskar Jihad hendak dipulangkan?
4_131	"Lampu hijaunya tetap besok, lanjut Kwik seperti dimaksud presiden."	"Lampu hijaunya tetap bEsok, lanjut Kwik seperti dimaksud prEsidEn."
4_132	"Landai-landai saja, lanjut Ikhsan."	"Landai-landai saja, lanjut Ikhsan."
4_133	Langkah dan kebijakan politik partai khususnya menjelang SI MPR.	Langkah dan kebijakan politik partai khususnya menjelang ES-I EM-PE-ER.
4_134	Laptop dan Amin tak terpisahkan.	Laptop dan Amin tak terpisahkan.
4_135	"Lava Mengalir, seratus ribu warga tunggu sirine."	"Lava Mengalir, seratus ribu warga tunggu sirine."
4_136	"Lebih baik ndak usah dulu, tegas kyai yang sangat disegani ini."	"Lebih baik enda usah dulu, tegas ki-yai yang sangat disegani ini."
4_137	Lebih detail Jimly mengatakan hal itu.	Lebih de-ta-il Jimli mengatakan hal itu.
4_138	"Lebih khusus lagi lempeng emas, lanjut Ngusman."	"Lebih khusus lagi lEmpEng emas, lanjut Ngusman."
4_139	"Lebih tepat dimuat dalam pembelaan atau pleidoi, tegas Kwik sebagai auditor."	"Lebih tepat dimuat dalam pembElaan atau plEi-doi, tegas Kwik sebagai auditor."
4_140	Ledakan bom sesuai waktu yang telah ditentukan hantui Banda Aceh lanjut Slamet.	Ledakan bom sesuai waktu yang telah ditentukan hantui Banda AcEh lanjut Slamet.
4_141	Ledakan di Maluku Bukan Ukuran Upaya Damai yang Gagal.	Ledakan di Maluku bukan ukuran upaya damai yang gagal.
4_142	"Ledakan itu terdengar sampai Hotel Sentral, lanjut Nyoman."	"Ledakan itu terdengar sampai HotEl SEntral, lanjut Nyoman."
4_143	"Ledakan tersebut disebabkan oleh mesiu yang terbakar, tegas Khotib sebagai ilmuwan."	"Ledakan tersebut disebabkan olEh mEsiu yang terbakar, tegas Kho-tib sebagai ilmuwan."
4_144	Lelaki asal Flores yang sudah begitu fasih berbahasa Betawi.	Lelaki asal FlorEs yang sudah begitu fasih berbahasa Betawi.
4_145	Lembaga Adat Minangkabau protes acara TVRI.	Lembaga Adat Minangkabau protEs acara TE-VE-ER-I.
4_146	"Lembaga PBB khusus untuk pengungsi, tegas Khofifah sebagai ungkapan syukur."	"Lembaga PE-BE-BE khusus untuk pengungsi, tegas Kho-fi-fah sebagai ungkapan syukur."
4_147	Leo Batubara lawan Wayn sebelumnya.	LEo Batubara lawan Wain sebelumnya.
4_148	Leo juga menolak berkomentar mengenai nasib Taufik selanjutnya.	LEo juga menolak berkomEntar mengenai nasib Taufik selanjutnya.
4_149	"Leo menjawab, lima belas peserta labil kritis."	"LEo menjawab, lima belas peserta labil kritis."
4_150	Lereng Dayeuhluhur Gunung Papandayan di Kabupaten Garut.	LErEng Dayeuhluhur Gunung Papandayan di KabupatEn Garut.
4_151	Letjen Syarwan Hamid memiliki Lima belas orang anggota.	LEtjEn Syar-wan Hamid memiliki lima belas orang anggota.
4_152	Letkol Wisnu yang dipagari kawat itu diawasi dengan ketat.	LEtkol Wisnu yang dipagari kawat itu diawasi dengan ketat.
4_153	"Lha gimana malah repot nanti, lanjut Roy."	"Lha gimana malah rEpot nanti, lanjut Roy."
4_154	"Libero Carsten Ramelow bermain cemerlang, lanjut Wayn."	"Li-bE-ro Kars-ten RaE-mE-low bermain cemerlang, lanjut Wayn."
4_155	Liem Hendra dan Mantan Kabulog Beddu Amang.	Lim HEndra dan Mantan Kabulog Bed-du Amang.
4_156	Lima orang berseragam cokelat sedang berjaga lanjut Yenny.	Lima orang berseragam coklat sedang berjaga lanjut YEnny.
4_157	Lima puluh empat orang anggota berkomunikasi lewat e-mail.	Lima puluh empat orang anggota berkomunikasi lEwat i-mail.
4_158	Lima ribu empat puluh mahasiswa Bandung pawai obor Kutuk Israel.	Lima ribu empat puluh mahasiswa Bandung pawai obor kutuk IsraEl.
4_159	Lisa Rumbewas menungging-nungging bagai kuda dan mengorek-ngorek kuping.	Lisa Rumbewas menungging-nungging bagai kuda dan mengorEk-ngorEk kuping.
4_160	Lokomotif anjlok di Stasiun Gambir jam lima lebih empat puluh menit pagi.	Lokomotif an-jlok di Stasiun Gambir jam lima lebih empat puluh menit pagi.
4_161	Ludes dilalap jago merah jam lima kurang empat puluh menit sore.	Ludes dilalap jago mErah jam lima kurang empat puluh menit sorE.
4_162	Lusa malam usai diterima ketua DPRD Edy Waluyo.	Lusa malam usai diterima ketua DE-PE-ER-DE Edy Waluyo.
4_163	Lusa siang usai unjuk rasa menentang RUU PKB.	Lusa siang usai unjuk rasa menentang ER-U-U PE-KA-BE.
4_164	"Maaf Pak Syafei Gade, Syarif Zulkarnaen telah tiba"	"Maaf Pak Sya-fE-i Gade, Sya-rif Zul-kar-naEn telah tiba"
4_165	Maaf ya lusa sore pukul lima lewat empat puluh menit aja.	Maaf ya lusa sorE pukul lima lEwat empat puluh menit aja.
4_166	Macet total seperti lusa pagi.	MacEt total seperti lusa pagi.
4_167	Macetnya reformasi karena Lippo Bank merupakan lonceng IMF.	MacEtnya rEformasi karena Lippo Bank merupakan loncEng I-EM-EF.
4_168	Magdalena Wenas yang memenangi empat buah Oscar pop Malaysia.	MagdalEna WEnas yang memenangi empat buah Oskar pop Malaysia.
4_169	Mahasiswa Universitas Airlangga tuduh DPR berkhianat pada rakyat.	Mahasiswa UnivErsitas Airlangga tuduh DE-PE-ER berkhianat pada rakyat.
4_170	Maka suasana harmoni wilayah DIY akan terganggu.	Maka suasana harmoni wilayah DE-I-YE akan terganggu.
4_171	"Makannya pun ngemil terus, tentu saja jadi gemuk, tutur Liza."	"Makan-nya pun ngemil terus, tentu saja jadi gemuk, tutur Liza."
4_172	Makanya saya juga sering nggak masuk kelas.	Maka-nya saya juga sering engga masuk kelas.
4_173	Makhluk manusia makin ramai yang berdoa.	Mahluk manusia makin ra-mai yang ber-do-a.
4_174	Maksud hati membina mahligai cinta.	Maksud hati membina mahligai cinta.
4_175	Malah ikut berkonspirasi membantai etnis Maluku.	Malah ikut berkonspirasi membantai Etnis Maluku.
