7_216	Sabtu sore rakyat ikuti Pemilu Zimbabwe.	Sabtu sorE rakyat ikuti Pemilu ZimbabwE.
7_217	Saham Zeni tempur atau Zipur milik Yulia Eko Syahputra yang turunnya paling drastis.	Saham Zeni tempur atau Zipur milik Yulia Eko Syah-put-ra yang turunnya paling drastis.
7_218	Salah sekali kalau kita memandang rendah atau enteng Amrozi.	Salah sekali kalau kita memandang rendah atau EntEng Amrozi.
7_219	Salah seorang warga Indonesia yang ditangkap di Bandara Ninoy Aquino.	Salah seorang warga IndonEsia yang ditangkap di Bandara Ni-noy A-qui-no.
7_220	Saleh Kholid Yafie Thahir dan Sahid Kurtubi sama-sama saling fitnah.	SalEh Kholid Yafi Thahir dan Sahid Kurtubi sama-sama saling fitnah.
7_221	Saling lempar bom molotov pun terjadi dalam jarak dekat.	Saling lEmpar bom molotov pun terjadi dalam jarak dekat.
7_222	Sambil menaiki mobil golf menuju Istana Merdeka.	Sambil menaiki mobil golf menuju Istana MerdEka.
7_223	Sambil menambahkan masih ada beberapa detail yang harus diselesaikan.	Sambil menambahkan masih ada beberapa de-ta-il yang harus diselesaikan.
7_224	Sampai dia akhirnya kehilangan pemain-pemain kunci yang dilanda cedera.	Sampai dia akhirnya kehilangan pemain-pemain kunci yang dilanda cedera.
7_225	Sampai hari ini tak ada itu ebtanas gratis.	Sampai hari ini tak ada itu Ebtanas gratis.
7_226	Sampai Irian Jaya tambah Bachrumsyah.	Sampai Irian Jaya, tambah Bahrumsyah.
7_227	Sampai kapan pun saya tetap menuntutnya walau ke akhirat.	Sampai kapan pun saya tetap menuntutnya walau ke akhirat.
7_228	Sampai minggu kedua Mei ini tutup enam puluh menit aja.	Sampai minggu kedua MEi ini tutup enam puluh menit aja.
7_229	Sampai ngomong seperti itu terhadap pleidoi pengacara Maya, tutur Anam.	Sampai ngomong seperti itu terhadap plEi-doi pengacara Maya, tutur Anam.
7_230	Sampai saat ini Polda belum panggil Fariz karena belum diperlukan.	Sampai saat ini Polda belum panggil Fariz karena belum diperlukan.
7_231	Sampai satu kali Jumat di Taman Intan Nginden Chrisye tiada.	Sampai satu kali Jumat di Taman Intan Nginden Khrisye tiada.
7_232	Sampai syarat-syarat bagi dipenuhinya skenario dasar bisa dipulihkan kembali.	Sampai syarat-syarat bagi dipenuhinya skEnario dasar bisa dipulihkan kembali.
7_233	Sampai tahap apa?	Sampai tahap apa?
7_234	Sampeyan mau apa sampai yang lainnya dan Tommy tertangkap?	Sampeyan mau apa sampai yang lainnya dan Tommy tertangkap?
7_235	Santai saja, tidak usah panik.	Santai saja, tidak usah panik.
7_236	Sarwono Oetomo dan Satrio Judono ternyata sanak saudara.	Sarwono Utomo dan Satrio Judono ternyata sanak saudara.
7_237	Satu dua satu tiga satu empat satu lima satu enam satu tujuh.	Satu dua satu tiga satu empat satu lima satu enam satu tujuh.
7_238	Satu hari sebelum pelaksanaan dia saya cuekin.	Satu hari sebelum pelaksanaan dia saya cuEkin.
7_239	Satu ranjang bersprei putih diisi satu orang.	Satu ranjang berseprEi putih diisi satu orang.
7_240	Sawo Cipete dan RS Fatmawati tidak jauh hanya tujuh ratus enam meter.	Sawo CipetE dan ER-ES Fatmawati tidak jauh hanya tujuh ratus enam mEter.
7_241	Saya berani jamin tidak akan pernah ada Jendral mbalelo.	Saya berani jamin tidak akan pernah ada JEndral mbalelo.
7_242	Saya berharap Jerman yang menang lima kosong ungkap Firman.	Saya berharap JErman yang menang lima kosong, ungkap Firman.
7_243	Saya berharap pasar meresponsnya positif ungkap Dradjat.	Saya berharap pasar merEsponsnya positif, ungkap Dradjat.
7_244	Saya berhasil terhubung ke IVR tujuh lewat lima puluh lima menit ungkap Brian.	Saya berhasil terhubung ke I-VE-ER tujuh lEwat lima puluh lima menit, ungkap Brian.
7_245	Saya dikatakan memanggil Saudara Sapuan yakni lima pemuda asal Wonogiri.	Saya dikatakan memanggil Saudara Sapuan, yakni lima pemuda asal Wonogiri.
7_246	Saya gali dari jam tiga pagi hingga satu kurang sepuluh menit siang.	Saya gali dari jam tiga pagi hingga satu kurang sepuluh menit siang.
7_247	Saya hanya melihat reformasi mandeg karena ada Golkar, katanya.	Saya hanya melihat rEformasi mandeg karena ada Golkar, katanya.
7_248	Saya imbau kepada jajaran partai apalagi kepada Pak Baramuli.	Saya imbau kepada jajaran partai apalagi kepada Pak Baramuli.
7_249	Saya imbaulah agar tidak terjadi seperti itu, kata salah satu muridnya.	Saya imbaulah agar tidak terjadi seperti itu, kata salah satu muridnya.
7_250	Saya jamin bahwa tarif transportasi tidak akan terganggu.	Saya jamin bahwa tarif transportasi tidak akan terganggu.
7_251	Saya juga kaget, kayaknya kok serius banget gitu.	Saya juga kagEt, kayaknya kok serius banget gitu.
7_252	Saya juga tidak tahu kalau Choirul Anam terlibat.	Saya juga tidak tahu kalau Khoirul Anam terlibat.
7_253	Saya kira juga Menkeu harus memeriksa segera pendanaan Jamsostek.	Saya kira juga MEnkeu harus memeriksa segera pendanaan JamsostEk.
7_254	Saya langsung dibonceng untuk mengejar mobil itu, ujar Joko.	Saya langsung diboncEng untuk mengejar mobil itu, ujar Joko.
7_255	Saya mau tanya total biaya pemakaian audioconference.	Saya mau tanya total biaya pemakaian audiokonferens.
7_256	Saya melakukan dialing ke kosong delapan kosong empat kosong enam satu kosong.	Saya melakukan dialing ke kosong delapan kosong empat kosong enam satu kosong.
7_257	Saya melakukan dialing ke nol delapan nol empat satu nol.	Saya melakukan dialing ke nol delapan nol empat satu nol.
7_258	Saya nggak tahu Pak Rizal nyolong dari mana.	Saya enggak tahu Pak Rizal nyolong dari mana.
7_259	Saya nyekar di makam Mbah Jenggot pukul satu pagi lebih sepuluh menit.	Saya nyekar di makam Mbah JEnggot pukul satu pagi lebih sepuluh menit.
7_260	Saya penyelidik, nggak boleh. Saya tidak tahu ujarnya mengelak.	Saya penyelidik, enggak bolEh saya tidak tahu ujarnya mengelak.
7_261	Saya pun bersedia mundur kalau memang ofisial tidak menanggapinya.	Saya pun bersedia mundur kalau MEmang ofisial tidak menanggapinya.
7_262	Saya risau tiga tahun terbengkalai. Saya pikir perlu evaluasi ungkap Listyo.	Saya risau tiga tahun terbengkalai, saya pikir perlu Evaluasi, ungkap Lis-tyo.
7_263	Saya sangat kecewa dengan sikap Saudara Amien Rais.	Saya sangat kecEwa dengan sikap Saudara A-mien Ra-is.
7_264	Saya senang bisa berkomunikasi denganmu.	Saya senang bisa berkomunikasi denganmu.
7_265	Saya sudah cari ke enam tempat tegas Ikhsan.	Saya sudah cari ke enam tempat tegas Ikhsan.
7_266	Saya terhubung ke IVR satu dini hari ungkap Khrisna.	Saya terhubung ke I-VE-ER satu dini hari ungkap Khrisna.
7_267	Saya tidak mengetahui detail tentang hal tersebut, ujarnya.	Saya tidak mengetahui de-ta-il tentang hal tersebut, ujarnya.
7_268	Saya tidak pandai untuk bernyanyi pop biasa tutur Yusuf Syakir.	Saya tidak pandai untuk bernyanyi pop biasa tutur Yu-suf Sya-kir.
7_269	Saya tidak pernah dengar ada imej publik yang baik.	Saya tidak pernah dengar ada imEj publik yang baik.
7_270	Saya tidak punya mandat ngomong soal materi.	Saya tidak punya mandat ngomong soal matEri.
7_271	Saya tidak tahu mengapa bisa ruwet begini?	Saya tidak tahu mengapa bisa ruwet begini?
7_272	Saya yakin kalau Edi tertangkap ungkap Kholis.	Saya yakin kalau Edi tertangkap, ungkap Kholis.
7_273	Saya, Kwik, Rudi dan Udin pengikut Mbah Hasyim dan Soekarno ungkap Yus.	Saya, Kwik, Rudi dan Udin pengikut Mbah Hasyim dan Sukarno, ungkap Yus.
7_274	Saya, Mantan Pangdam Jaya Sjafrie Syamsudin, khawatir tanpa syarat.	Saya, Mantan Pangdam Jaya Syaf-rie Syam-sudin, khawatir tanpa syarat.
7_275	Sayang hurufnya terlalu kecil.	Sayang hurufnya terlalu kecil.
7_276	Sayang Nguyen sangat cerdik, dia bermain waktu.	Sayang Nguyen sangat cerdik, dia bermain waktu.
7_277	Sayed Hoesainy dikejar fans sebab ganteng.	SayEd Hu-sai-ny dikejar fans sebab ganteng.
7_278	SBY meminta masyarakat wajib hormati kebebasan beribadah.	ES-BE-YE meminta masyarakat wajib hormati kebEbasan beribadah.
7_279	Seandainya Abdurrahman Wahid turun.	Seandainya Ab-dur-rah-man Wa-hid turun.
7_280	Seandainya prestasi Widigdo bagus.	Seandainya prEstasi Widigdo bagus.
7_281	Sebab filosofi WTO adalah meningkatkan taraf hidup masyarakat.	Sebab filosofi WE-TE-O adalah meningkatkan taraf hidup masyarakat.
7_282	Sebab hingga saat ini, termasuk Yerussalem berada pada status quo.	Sebab hingga saat ini, termasuk Yerussalem berada pada status quo.
7_283	Sebab jika kita tidak tahu kan bahaya.	Sebab jika kita tidak tahu kan bahaya.
7_284	Yang membawa perisai adalah Yoshiro Mori yang sakit flu adalah Yakub Hutapea.	Yang membawa perisai adalah Yoshiro Mori, yang sakit flu adalah Yakub HutapEa.
7_285	Yang merupakan arus dua arah dari arah Ciledug maupun Tangerang.	Yang merupakan arus dua arah dari arah Ciledug maupun Tangerang.
7_286	Yang penting Ukhuwah Islamiyah tetap dijaga, katanya.	Yang penting Ukhuwah Islamiyah tetap dijaga, katanya.
7_287	Yang perlu dibenahi dari Pemprov Banten itu preventifnya ujar Yoris Raweyai.	Yang perlu dibenahi dari PEmprov Banten itu prEvEntifnya, ujar Yoris Raweyai.
7_288	Yang telah dirintis Saudara Susilo Bambang Yudhoyono.	Yang telah dirintis Saudara Susilo Bambang Yudhoyono.
7_289	Yang tidak menyediakan halte untuk perhentian kendaraan.	Yang tidak menyediakan halte untuk perhentian kendaraan.
7_290	Yang udah pasti ikut itu Yesus Flores Zarnubi enggan menjelaskan secara detil.	Yang udah pasti ikut itu YEsus FlorEs Zarnubi enggan menjelaskan secara detil.
7_291	Yunus Yosfiah terkait dengan jaringan suplai global.	Yunus Yosfiah terkait dengan jaringan suplai global.
7_292	Yusril Ihza tampak ceria dengan baju koko warna hijau cerah.	Yusril Ihza tampak ceria dengan baju koko warna hijau cerah.
7_293	Yusril khawatir dengan keselamatan warga Kayu Jati pun kalau rumahnya reyot.	Yusril khawatir dengan keselamatan warga Kayu Jati pun kalau rumahnya rEyot.
7_294	Yusril menyatakan bahwa Depkeh tidak berwenang tentukan PKB yang sah.	Yusril menyatakan bahwa DEpkEh tidak berwenang tentukan PE-KA-BE yang sah.
7_295	Yusuf Imranlah yang membawa uang tunai itu ke pertemuan antar kepala daerah.	Yusuf Imranlah yang membawa uang tunai itu ke pertemuan antar kepala daErah.
7_296	Yusuf juga menilai Wonosobo dan Pekalongan akan menang.	Yusuf juga menilai Wonosobo dan Pekalongan akan menang.
7_297	Yusuf Zakir sebagai imam sholat sunnah yang berlangsung khusyuk usai sholat dzuhur.	Yusuf Zakir sebagai imam sholat sunnah yang berlangsung khusyuk usai sholat dzuhur.
7_298	Zat pewarna menggunakan zat yang terkandung dalam wortel.	Zat pewarna menggunakan zat yang terkandung dalam wortel.
7_299	Ziarah Keluarga Yusuf Surahman itu Berakhir Nestapa.	Ziarah Keluarga Yusuf Surahman itu Berakhir Nestapa.
7_300	Zone khusus TNI angkatan udara dikepalai Zukri Amin.	Zone khusus TE-EN-I angkatan udara dikepalai Zukri Amin.
